{
  "$schema": "https://json-schema.org/draft/2020-12/schema",
  "additionalProperties": true,
  "properties": {
    "accepted": {"const": true},
    "baselines": {"type": "object"},
    "claim_scope": {"type": "string"},
    "datasets": {"type": "array", "minItems": 1},
    "date_run": {"type": "string"},
    "evidence_level": {"type": "string"},
    "git_commit": {"type": "string"},
    "gpu_name": {"type": "string", "minLength": 1},
    "gt_tier": {"const": "GT-0"},
    "known_failures": {"type": "array", "maxItems": 0},
    "metrics": {"type": "object"},
    "models": {"type": "array", "minItems": 1},
    "negative_controls": {"type": "object"},
    "notebook_id": {"const": "14_2_ijepa_from_scratch"},
    "ood_tests": {"type": "object"},
    "peak_vram_gb": {"minimum": 0, "maximum": 24, "type": "number"},
    "report_inputs": {
      "properties": {
        "algorithm": {"const": "sha256", "type": "string"},
        "combined_sha256": {"type": "string"},
        "files": {"items": {"type": "object"}, "minItems": 1, "type": "array"},
        "schema_version": {"const": 1, "type": "integer"}
      },
      "required": ["schema_version", "algorithm", "combined_sha256", "files"],
      "type": "object"
    },
    "safety_notes": {"type": "array"},
    "tests_passed": {"const": true},
    "wall_clock_seconds": {"minimum": 0, "maximum": 300, "type": "number"}
  },
  "required": [
    "notebook_id", "date_run", "git_commit", "report_inputs", "gt_tier",
    "evidence_level", "claim_scope", "gpu_name", "peak_vram_gb",
    "wall_clock_seconds", "models", "datasets", "tests_passed", "metrics",
    "baselines", "negative_controls", "ood_tests", "known_failures",
    "safety_notes", "accepted"
  ],
  "title": "ARENA extension verification report",
  "type": "object"
}
