{
  "accepted": true,
  "baselines": {
    "declared_controls": [
      "exact_generated_scene_labels",
      "exact_object_pixel_containment_test",
      "hand_computed_patchify_oracle",
      "hand_computed_encoder_projection_position_oracle",
      "exact_predictor_context_scatter_and_mask_oracle",
      "shape_correct_zero_module_rejection",
      "contiguous_block_mask_invariant",
      "unequal_mask_cardinality_rejection",
      "normalized_loss_scale_invariance",
      "exact_ema_parameter_update",
      "frozen_target_gradient_boundary",
      "disjoint_train_evaluation_scene_seeds",
      "zero_exact_train_evaluation_image_overlap",
      "position_and_ordinal_matched_cyclic_key_source",
      "exact_key_only_intervention_negative_control",
      "exact_key_erasure_negative_control",
      "all_three_predeclared_seeds",
      "exact_prediction_metric_oracle",
      "fabricated_prediction_report_rejection",
      "zero_non_key_pixel_difference",
      "zero_context_prediction",
      "same_initialized_untrained_architecture",
      "same_initialized_joint_target_no_ema_training_ablation",
      "exact_first_step_shared_parameter_parity",
      "shuffled_training_labels",
      "exact_constant_feature_collapse_control",
      "random_encoder_probe_negative_result",
      "learner_validate_run_fail_closed_fixture",
      "no_op_validator_rejection",
      "all_solution_dropdowns_ast_parse"
    ],
    "expected_metrics": {
      "accepted": true,
      "all_seeds_accepted": true,
      "alternate_key_accuracy_min": 0.9,
      "collapsed_effective_rank_max": 1.01,
      "collapsed_feature_std_max": 1e-07,
      "cuda_available": true,
      "effective_rank_min": 1.5,
      "feature_std_min": 0.02,
      "heldout_prediction_accuracy_min": 0.9,
      "joint_target_ablation_prediction_accuracy_max": 0.75,
      "key_erased_context_accuracy_max": 0.5,
      "key_erased_non_key_pixel_max_abs_diff_max": 0.0,
      "key_erased_to_correct_loss_ratio_min": 1.1,
      "loss_ratio_max": 0.2,
      "main_to_joint_target_feature_std_ratio_min": 5.0,
      "max_allowed_gpu_gb": 24,
      "mismatched_context_accuracy_max": 0.1,
      "mismatched_to_correct_loss_ratio_min": 1.1,
      "non_key_pixel_max_abs_diff_max": 0.0,
      "random_encoder_object_probe_accuracy_min": 0.9,
      "random_prediction_accuracy_max": 0.5,
      "random_to_trained_loss_ratio_min": 20.0,
      "shared_semantic_template_count": 12,
      "tests_passed": true,
      "train_eval_exact_overlap": 0,
      "within_vram_budget": true,
      "worst_seed_key_erased_accuracy_max": 0.5,
      "worst_seed_prediction_accuracy_min": 0.9,
      "zero_to_correct_loss_ratio_min": 5.0
    }
  },
  "claim_scope": "A small I-JEPA trained from scratch on an exact generated image world uses a visible class-colour key to predict the target latent of a fully masked object on pixel-distinct scenes sharing all twelve semantic templates. Correct context recovers object class, while a key-only cyclic replacement changes the prediction to the alternate key class while every other pixel remains fixed. Erasing the image-space key reduces accuracy to chance, zero latent context raises loss, and an untrained architecture remains at chance. A matched jointly optimized target ablation attains very low latent loss while compressing feature spread and weakening held-out prediction. Linear probes are explicitly not evidence here because random encoder features already decode this easy world. This is not an ImageNet or checkpoint-parity claim.",
  "datasets": [
    {
      "evaluation_seeds": [
        50000,
        50001,
        50002
      ],
      "exact_train_evaluation_overlap": 0,
      "examples_per_seed_per_split": 120,
      "id": "course_generated_ijepa_predictive_key_world_v2",
      "image_size": "32x32",
      "key_patch": "rows_0_3_columns_12_15",
      "object_classes": 3,
      "object_labels_used_in_loss": false,
      "object_radius_pixels": 3,
      "position_classes": 4,
      "position_labels_used_for_target_selection": true,
      "production_jitter_pixels": 0,
      "shared_semantic_templates": 12,
      "source": "deterministic_tensor_generator",
      "train_seeds": [
        0,
        1,
        2
      ]
    }
  ],
  "date_run": "2026-09-04T23:56:48+00:00",
  "evidence_level": "cuda_verified_exact_predictive_world",
  "git_commit": "8eab192b",
  "gpu_name": "NVIDIA GeForce RTX 5090 Laptop GPU",
  "gt_tier": "GT-0",
  "known_failures": [],
  "metrics": {
    "gpu_evidence": {
      "category": "cuda_section_metric",
      "placeholder_only": false,
      "section_specific_metric_keys": [
        "accepted",
        "all_seeds_accepted",
        "alternate_key_accuracy",
        "collapsed_control_diagnostics",
        "collapsed_control_probes",
        "collapsed_effective_rank",
        "collapsed_feature_std",
        "contract_passed",
        "contract_seeds",
        "diagnostics",
        "effective_rank",
        "evaluation_semantic_template_count",
        "feature_std",
        "final_loss",
        "heldout_prediction_accuracy",
        "initial_loss",
        "joint_target_ablation_prediction_accuracy",
        "joint_target_diagnostics",
        "joint_target_prediction",
        "joint_target_probes",
        "joint_target_trace",
        "key_erased_context_accuracy",
        "key_erased_non_key_pixel_max_abs_diff",
        "key_erased_to_correct_loss_ratio",
        "loss_ratio",
        "main_to_joint_target_feature_std_ratio",
        "max_allowed_gpu_gb",
        "minimum_reported_effective_rank",
        "mismatched_context_accuracy",
        "mismatched_to_correct_loss_ratio",
        "non_key_pixel_max_abs_diff",
        "object_probe_margin_over_random",
        "per_seed",
        "position_probe_margin_over_random",
        "prediction",
        "probes",
        "random_encoder_object_probe_accuracy",
        "random_encoder_position_probe_accuracy",
        "random_encoder_probes",
        "random_prediction",
        "random_prediction_accuracy",
        "random_to_trained_loss_ratio",
        "seed",
        "shared_semantic_template_count",
        "shuffled_label_probes",
        "target_has_gradients",
        "target_parameter_change",
        "tests_passed",
        "trace",
        "train_eval_exact_overlap",
        "train_semantic_template_count",
        "worst_seed_key_erased_accuracy",
        "worst_seed_prediction_accuracy",
        "zero_to_correct_loss_ratio"
      ],
      "uses_cuda": true
    },
    "gpu_test": {
      "accepted": true,
      "all_seeds_accepted": true,
      "alternate_key_accuracy": 1.0,
      "collapsed_control_diagnostics": {
        "effective_rank": 1.0,
        "feature_std": 0.0,
        "mean_pairwise_cosine": 0.0
      },
      "collapsed_control_probes": {
        "object_accuracy": 0.3333333432674408,
        "position_accuracy": 0.25
      },
      "collapsed_effective_rank": 1.0,
      "collapsed_feature_std": 0.0,
      "contract_passed": true,
      "contract_seeds": [
        0,
        1,
        2
      ],
      "cuda_available": true,
      "cuda_version": "13.2",
      "device": "NVIDIA GeForce RTX 5090 Laptop GPU",
      "diagnostics": {
        "effective_rank": 2.657756805419922,
        "feature_std": 0.028207167983055115,
        "mean_pairwise_cosine": 0.008065707981586456
      },
      "effective_rank": 2.657756805419922,
      "evaluation_semantic_template_count": 12,
      "feature_std": 0.028207167983055115,
      "final_loss": 0.007618053454077907,
      "gpu_name": "NVIDIA GeForce RTX 5090 Laptop GPU",
      "gpu_total_memory_gb": 23.45965576171875,
      "heldout_prediction_accuracy": 1.0,
      "initial_loss": 1.2013709545135498,
      "joint_target_ablation_prediction_accuracy": 0.31666669249534607,
      "joint_target_diagnostics": {
        "effective_rank": 5.120816707611084,
        "feature_std": 0.002456510905176401,
        "mean_pairwise_cosine": -0.0023740192409604788
      },
      "joint_target_prediction": {
        "alternate_key_object_accuracy": 0.31666669249534607,
        "key_erased_context_loss": 0.0006285534473136067,
        "key_erased_context_object_accuracy": 0.3333333432674408,
        "key_erased_non_key_pixel_max_abs_diff": 0.0,
        "latent_loss": 0.0006281095556914806,
        "mismatched_context_loss": 0.0006285530980676413,
        "mismatched_context_object_accuracy": 0.3333333432674408,
        "non_key_pixel_max_abs_diff": 0.0,
        "predicted_object_accuracy": 0.31666669249534607,
        "target_object_accuracy": 1.0,
        "zero_context_loss": 0.04178973287343979
      },
      "joint_target_probes": {
        "object_accuracy": 1.0,
        "position_accuracy": 1.0
      },
      "joint_target_trace": {
        "effective_rank": [
          2.5547068119049072,
          2.9766488075256348,
          3.2551426887512207,
          3.4241819381713867,
          3.578068733215332,
          3.7387237548828125,
          3.869457244873047,
          3.988776683807373,
          4.104335308074951,
          4.194749355316162,
          4.255471229553223,
          4.298121452331543,
          4.332817077636719,
          4.372283935546875,
          4.415940761566162,
          4.445762634277344,
          4.458968162536621,
          4.472289562225342,
          4.4919939041137695,
          4.509576797485352,
          4.525434970855713,
          4.536887168884277,
          4.542344093322754,
          4.550007343292236,
          4.558640003204346,
          4.567126274108887,
          4.574802875518799,
          4.581700801849365,
          4.585698127746582,
          4.5928497314453125
        ],
        "feature_std": [
          0.03209449350833893,
          0.014536868780851364,
          0.009368689730763435,
          0.007264073938131332,
          0.006001521833240986,
          0.005060166120529175,
          0.004431809764355421,
          0.003986523486673832,